{
  "mappingsVersion": 1,
  "target": {
    "language": "de",
    "os": "mac"
  },
  "layers": {
    "alpha": 0,
    "extra": [
      {
        "id": "layer1",
        "name": "Symbols",
        "index": 1
      },
      {
        "id": "layer2",
        "name": "Numbers",
        "index": 2
      },
      {
        "id": "layer3",
        "name": "Navigation",
        "index": 3
      }
    ]
  },
  "alphaMappings": {
    "Q": {
      "layer1": "°",
      "layer2": "NO",
      "base": null,
      "aliases": []
    },
    "W": {
      "layer1": "^",
      "layer2": "NO",
      "base": null,
      "aliases": []
    },
    "E": {
      "layer1": "{",
      "layer2": "NO",
      "base": null,
      "aliases": []
    },
    "R": {
      "layer1": "}",
      "layer2": "NO",
      "base": null,
      "aliases": []
    },
    "T": {
      "layer1": "%",
      "layer2": "NO",
      "base": null,
      "aliases": []
    },
    "Y": {
      "layer1": "$",
      "layer2": "NO",
      "base": null,
      "aliases": []
    },
    "U": {
      "layer1": "ü",
      "layer2": "+",
      "base": null,
      "aliases": []
    },
    "I": {
      "layer1": "&",
      "layer2": "-",
      "base": null,
      "aliases": []
    },
    "O": {
      "layer1": "ö",
      "layer2": "*",
      "base": null,
      "aliases": []
    },
    "P": {
      "layer1": "§",
      "layer2": "/",
      "base": null,
      "aliases": []
    },
    "_row2": {
      "layer1": null,
      "layer2": null,
      "base": null,
      "aliases": []
    },
    "A": {
      "layer1": "ä",
      "layer2": "1",
      "base": null,
      "aliases": []
    },
    "S": {
      "layer1": "ß",
      "layer2": "2",
      "base": null,
      "aliases": []
    },
    "D": {
      "layer1": "#",
      "layer2": "3",
      "base": null,
      "aliases": []
    },
    "F": {
      "layer1": "!",
      "layer2": "4",
      "base": null,
      "aliases": []
    },
    "G": {
      "layer1": "-",
      "layer2": "5",
      "base": null,
      "aliases": []
    },
    "H": {
      "layer1": "\"",
      "layer2": "6",
      "base": "TD(H_GUIH)",
      "aliases": [
        "TD(H_GUIH)"
      ]
    },
    "J": {
      "layer1": "?",
      "layer2": "7",
      "base": null,
      "aliases": []
    },
    "K": {
      "layer1": "(",
      "layer2": "8",
      "base": null,
      "aliases": []
    },
    "L": {
      "layer1": ")",
      "layer2": "9",
      "base": null,
      "aliases": []
    },
    "_row3": {
      "layer1": null,
      "layer2": null,
      "base": null,
      "aliases": []
    },
    "Z": {
      "layer1": "<",
      "layer2": "NO",
      "base": null,
      "aliases": []
    },
    "X": {
      "layer1": ">",
      "layer2": "NO",
      "base": null,
      "aliases": []
    },
    "C": {
      "layer1": "[",
      "layer2": "NO",
      "base": null,
      "aliases": []
    },
    "V": {
      "layer1": "]",
      "layer2": "NO",
      "base": null,
      "aliases": []
    },
    "B": {
      "layer1": "'",
      "layer2": "NO",
      "base": null,
      "aliases": []
    },
    "N": {
      "layer1": "`",
      "layer2": "NO",
      "base": null,
      "aliases": []
    },
    "M": {
      "layer1": "_",
      "layer2": "=",
      "base": null,
      "aliases": []
    },
    ".": {
      "layer1": "NO",
      "layer2": "NO",
      "base": null,
      "aliases": []
    },
    ",": {
      "layer1": "|",
      "layer2": "NO",
      "base": null,
      "aliases": []
    },
    "-": {
      "layer1": "NO",
      "layer2": "NO",
      "base": null,
      "aliases": []
    }
  },
  "comboOverrides": [
    {
      "keys": [
        "KC_J",
        "KC_K"
      ],
      "result": "KC_BSPC"
    },
    {
      "keys": [
        "KC_J",
        "KC_K",
        "KC_L"
      ],
      "result": "LALT(KC_BSPC)"
    },
    {
      "keys": [
        "KC_K",
        "KC_L"
      ],
      "result": "KC_DEL"
    },
    {
      "keys": [
        "KC_7",
        "KC_8"
      ],
      "result": "KC_BSPC"
    },
    {
      "keys": [
        "KC_4",
        "KC_5"
      ],
      "result": "KC_BSPC"
    },
    {
      "keys": [
        "KC_5",
        "KC_6"
      ],
      "result": "KC_DEL"
    }
  ],
  "tapDanceOverrides": [
    {
      "name": "H_GUIH",
      "trigger": "KC_H",
      "tap": "KC_H",
      "hold": "LGUI(KC_H)"
    }
  ],
  "keyOverrideOverrides": [],
  "comboOverrideExample": [
    {
      "comment": "Example shape only; not used unless moved into comboOverrides",
      "keys": [
        "KC_Q",
        "KC_W"
      ],
      "result": "KC_ESC",
      "layers": [
        0
      ]
    }
  ],
  "tapDanceOverrideExample": [
    {
      "comment": "Example shape only; not used unless moved into tapDanceOverrides",
      "trigger": "KC_H",
      "tap": "KC_H",
      "hold": "LGUI(KC_H)"
    }
  ],
  "keyOverrideOverrideExample": [
    {
      "comment": "Example shape only; not used unless moved into keyOverrideOverrides",
      "trigger": "KC_SCLN",
      "mods": "MOD_MASK_SHIFT",
      "replacement": "KC_COLN"
    }
  ]
}